{
  "schema_version": "1.0",
  "generated_at": "2026-05-24T01:05:05.002287+00:00",
  "symbol": "TEST",
  "horizon": "1-5 trading days",
  "recommendation": "SELL",
  "confidence": 0.9,
  "rationale": [
    "Debate net score is -0.850.",
    "RSI14=0.00, MACD histogram=-1.788499.",
    "VaR95=0.0157, CVaR95=0.0165.",
    "All non-HOLD actions require risk review and human approval."
  ],
  "indicators": {
    "close": 107.541,
    "return_1d": -0.00407,
    "return_5d": -0.034165,
    "ma20": 118.037435,
    "ma50": 114.758398,
    "rsi14": 0.0,
    "macd": -3.023738,
    "macd_signal": -1.235239,
    "macd_hist": -1.788499,
    "volatility20": 0.05195,
    "max_drawdown60": 0.174073,
    "var95": 0.015662,
    "cvar95": 0.016523
  },
  "order": {
    "action": "SELL",
    "quantity": 92,
    "order_type": "LIMIT",
    "limit_price": 107.3259,
    "stop_loss": 109.6918,
    "take_profit": 103.2394,
    "time_in_force": "DAY"
  },
  "risk": {
    "max_position_pct": 0.1,
    "max_loss_pct": 0.02
  },
  "human_approval_required": true
}
